"2024/04/22 3:45:48 AM MDT","Someone who, when complimented, tends to respond with the same compliment. So they mean to be nice, but they don't know what else to say.","Yes","No","Yes","Yes","Neutral","Neutral","Perhaps a bit lonely, and takes initiative to address that.","Neutral","No","Yes","Yes","Neutral","Neutral","Teary sad emoji","Could be pouty, could be pleading, could be sad but wanting to be a little cute about it","1","I honestly don't remember when. I know I have used it though.","2","I kind of like the newer, slightly different version of it better. It's virtually the same expression, but with a slight smile. I use that more often, as I can use it in situations to emphasize that I'm thankful 🥹","Yes, at Reed college","18-25","Nonbinary","Yes"
"2024/04/22 11:52:21 AM MDT","They seem nice!","Yes","No","Yes","Yes","Neutral","Neutral","They want to spend time with their friends and are also trying to be funny","Yes","No","Yes","No","Neutral","Neutral","The pleading face emoji because that’s what Discord calls it, but I would also call it the puppy doll eyes emoji","It means you want something, often validation or companionship","3","I mostly use it when talking to my friends, especially my female friends. I started using it less with my friends once I started dating somebody","4","","Yes, at Reed college","18-25","Woman","Yes"
"2024/04/22 12:27:59 PM MDT","genuine, talks a lot, very positive","Yes","No","Yes","Neutral","Neutral","Yes","needy, lonely, last-minute planner ","Yes","Yes","Yes","No","Neutral","Yes","annoying ass emoji ","puppy eyes","0","when I'm being sarcastic","0","It's less the emoji I don't like than the patterns I've seen of the people who use it","Yes, at Reed college","18-25","Nonbinary","Yes"
"2024/04/22 1:08:06 PM MDT","Supportive. Kind","Yes","No","Yes","Yes","Neutral","Yes","Lonely, she wants to hang out over the summer with friends but didn’t want to ask them out directly ","Yes","Neutral","Yes","Neutral","Neutral","Neutral","Puppy eyes","You want something and the other person says no but you persist and try to get them to say yes","0","Pretty please (insert emoji here)","1","","Yes, at Reed college","18-25","Man","No"
"2024/04/23 11:20:35 AM MDT","very sweet and interested in the conversation (good at texting) possibly a younger person based on texting style","Yes","No","Yes","Yes","Neutral","Yes","someone who is dependent on the response for conversation","Neutral","No","Neutral","No","Neutral","Neutral","uwu","pleading but in a ‘cute’ way","0","n/a","0","","Yes, at Reed college","18-25","Woman","No"
"2024/04/23 1:00:03 PM MDT","They don't seem too expressive over text, but they seem very genuine and straight-forward.","Neutral","No","Yes","Yes","Yes","No","I would describe them as maybe a bit self-pitying? But props to them for initiating plans with Jules.","Yes","Yes","Neutral","Neutral","Neutral","Yes","pleading","it mean's you're either asking/begging for something or you think something is super cute","2","i use it to describe things that are super cute, but maybe a bit sad/pitiable","2","","Yes, at Reed college","18-25","genderfluid?","No"
"2024/04/23 3:42:32 PM MDT","","Neutral","Yes","Yes","No","Neutral","Yes","","Yes","Neutral","Yes","Yes","No","Yes","puppy dog eyes","pleading/please but make it cute or teasing","1","when i want something but it's not serious","2","Consistently annoyed by people who send seven tiny messages instead of one longer one. I hate my notification sound and I don't need to hear it 10000 times per convo because the send button is a siren song","Yes, at Reed college","18-25","Nonbinary","No"
"2024/04/23 10:13:04 PM MDT","","Yes","Neutral","Neutral","No","Yes","Yes","","Neutral","No","Neutral;Yes","Neutral","No","Yes","'pleading eyes' emoji","begging or pleading, possibly in a tongue-in-cheek kind of way. 
alternatively, a sad or dejected expression.","0","","2","I associate its use with very-online transgender women.","Yes, at Reed college","25-40","Man","No"
"2024/04/24 5:13:24 PM MDT","sweet and seems like a teenager","Yes","No","Yes","Yes","Neutral","Yes","somewhat funny and friendly","Neutral","No","Yes","Neutral","Neutral","Yes","puppy eyes emoji","It means pretty please or i’m sorry but like a little kid begging for something","2","I use it when i’m asking for something generally ironically like with the fingers 👉👈","2","I think it’s embarrassing if used seriously but a kinda fun emoji","Yes, at Reed college","18-25","Woman","No"
"2024/04/24 6:52:42 PM MDT","young adult/teen/gen z; likely feminine","No","No","Neutral","Neutral","Yes","Yes","also younger, fem, gen z; sad","Yes","Neutral","Yes","Neutral","Yes","Yes","awwwww emoji; or ill describe it by making the face like the *make the face* emoji","either something is really sweet/wholesome/thoughtful or expressing sadness/wanting someone’s help with something","4","i use it when my friends/partners say something sweet to me or do something thoughtful, or when im making a request of them when i need something ","4","super interesting topic i love this emoji!! im a ling major and id love to hear about your results if you’re willing to share:) my email is lichtenbergmaeve@reed.edu","Yes, at Reed college","18-25","Woman","No"
"2024/04/25 2:39:48 PM MDT","Wren is insecure and really does appreciate the complement. Seems genuine ","Yes","No","Neutral","No","Neutral","Neutral","Shy asf ","Neutral","No","Yes","Yes","No","Yes","Pout ","Pleaaaase ","2","Pleasing people or using it when I feel shy abt saying something ","2","","Yes, at Reed college","18-25","Woman","No"
"2024/05/01 5:07:08 PM MDT","They’re pretty open and nice, last comment is throwing me off cus what does that mean lmao","Yes","Neutral","Yes","Neutral","Neutral","Yes","Average female friendship moment","Yes","No","Neutral","Neutral","Neutral","Yes","I don’t have a name for it but mb like the begging or cute emoji ","Initially it meant I am trying to do puppy dog eyes to convey love or desperation/sincerity or smth and was obnoxious but now it is quite funny I think","2","I use it between friends when I’m expressing affection but kinda or fully joking ","2","Maybe I’m just stupid but I didn’t get that the survey was abt the emoji so good job","Yes, at Reed college","18-25","Woman","No"
"2024/05/02 12:00:04 AM MDT","they seem like they value the opinions of the people in their life ","Yes","No","Yes","Yes","Neutral","Yes","they seem unsure ","Yes","No","Yes","Yes","Neutral","Neutral","cutie patootie ","it adds a sense of cuteness/ some kind of empathic emotion to whatever you’re talking about ","4","when apologizing or asking someone for something or just to saw awww ","4","","Yes, at Reed college","18-25","Nonbinary","No"